{
  "$schema": "urn:watchtower:schema:interfaces:packs:knowledge-index:v1",
  "id": "index.knowledge.offensive_security.ctf",
  "title": "Offensive Security CTF Knowledge Index",
  "status": "active",
  "pack_id": "pack.offensive_security.ctf",
  "entries": [
    {
      "knowledge_id": "knowledge.promoted.offensive_security.ctf.smb_enumeration",
      "title": "Prioritize anonymous SMB enumeration before password guessing",
      "summary": "Promoted reusable tactic derived from structured extraction output and explicit review.",
      "status": "active",
      "knowledge_family": "tactic",
      "canonical_path": "domain_packs/offensive_security/shared/knowledge/tactics/smb_enumeration.md",
      "promotion_record_id": "promotion.record.offensive_security.ctf.tryhackme_blue.smb_enum",
      "extraction_output_id": "extraction.output.offensive_security.ctf.tryhackme_blue.initial",
      "promoted_at": "2026-03-10T06:47:00Z",
      "source_work_item_ids": [
        "work.item.tryhackme.blue"
      ],
      "trace_id": "trace.offensive_security.ctf.tryhackme_blue",
      "tags": [
        "smb",
        "enumeration",
        "windows"
      ]
    }
  ]
}
